{
  "schema_version": "1.0",
  "session_id": "12440000-0000-4000-8000-000000000003",
  "subject_id": "treasury-allocation",
  "created_at": "2026-08-26T16:10:00Z",
  "prompt_hash": "0x5555555555555555555555555555555555555555555555555555555555555555",
  "inputs_digest": "0x6666666666666666666666666666666666666666666666666666666666666666",
  "quorum": {
    "active": 2,
    "submitted": 2,
    "absent": 0,
    "participation_bps": 10000
  },
  "stances": {
    "bearish": 0,
    "cautious": 0,
    "neutral": 1,
    "constructive": 1,
    "bullish": 0
  },
  "judge": {
    "rationale": "Réserve & liquidité — the stable-yield sleeve stays <60% while 保守的な運用 keeps the protocol sleeve intact.\nSecond line, after a real newline. After U+2028. After U+2029. Rockets 🚀 are astral-plane; a\\backslash and a \"quoted phrase\" are here too, and 5 > 3 & 2 < 4. That was a non-breaking space.",
    "disagreements": [
      {
        "topic": "Réserve size — <stable-yield> & the 6 > 5 threshold 🚀",
        "positions": [
          {
            "member_id": "analyst-alpha",
            "view": "Use a 55% stable-yield weight — через протокол.\nLine two."
          },
          {
            "member_id": "analyst-beta",
            "view": "Use a 65% stable-yield weight; 65 > 55 & the regime is 慎重. Line two."
          }
        ],
        "what_settles": "Next session's regime read — if the composite is <30 the reserve moves 🚀."
      }
    ],
    "release_safety": {
      "release": "hold",
      "thinly_supported": false,
      "take_count": 2,
      "min_takes": 2,
      "concerns": [
        "Concentration risk in <conservative_defi_yield> at 60% — 過度の集中 & no hedge.\nSee the memo.",
        "Tab\there, backslash\\here, quote\"here 🚀."
      ]
    },
    "source": "model",
    "mode": "enforce"
  },
  "analyst_signatures": [
    {
      "member_id": "analyst-alpha",
      "public_key": "T5RBDrNc2aEMfLwkqjIGTP/znuEyqJfXEgiDp+tI++E=",
      "canonical_submission": "{\"memberId\":\"analyst-alpha\",\"date\":\"2026-08-26\",\"subjectId\":\"treasury-allocation\",\"nonce\":\"fusion-1244-alpha-1\",\"stance\":\"constructive\",\"confidence\":82,\"body\":\"Prefer stable yield while retaining measured protocol and agent exposure.\",\"memoUrl\":\"https://robotmoney.net/swarm/memos/1244-alpha\",\"weights\":[{\"bucket\":\"agent_tokens\",\"weight\":0.15},{\"bucket\":\"conservative_defi_yield\",\"weight\":0.55},{\"bucket\":\"protocol_tokens\",\"weight\":0.2},{\"bucket\":\"real_world_assets\",\"weight\":0.1}]}",
      "signature": "TZP4JS/6PCwulIjt/oOpybFYwcjAIivcQFfRcLrEemxN/3USQNaT4k/rnRhL1MY5vun+oZ4JKwFBCTt2BsZrBw==",
      "revision": 1
    },
    {
      "member_id": "analyst-beta",
      "public_key": "8sm2iDFmMpmit1ULIYa0ULNrPV+ynvmfl7I2+ufUNUA=",
      "canonical_submission": "{\"memberId\":\"analyst-beta\",\"date\":\"2026-08-26\",\"subjectId\":\"treasury-allocation\",\"nonce\":\"fusion-1244-beta-1\",\"stance\":\"neutral\",\"confidence\":74,\"body\":\"Keep a diversified allocation with a larger stable-yield reserve.\",\"memoUrl\":\"https://robotmoney.net/swarm/memos/1244-beta\",\"weights\":[{\"bucket\":\"agent_tokens\",\"weight\":0.1},{\"bucket\":\"conservative_defi_yield\",\"weight\":0.65},{\"bucket\":\"protocol_tokens\",\"weight\":0.15},{\"bucket\":\"real_world_assets\",\"weight\":0.1}]}",
      "signature": "CwU5/gOXHFa369r/ld1lL6TwA6do7z9Iwh8HvBEtA9COuzfmoZr/LD3Er6PSD7cQcy4iBfHxLOn6ptsC2XjjCQ==",
      "revision": 1
    }
  ]
}
